,0
1046,"required qualifications:


12+ years of software product development experience

10+ years of experience with leading solid software engineering development and operations teams and 5+ years of building & managing high performance engineering teams

5+ years of experience in understanding data platform (data ingestion, data replication, data redundancy, data movement, etl, streams, relational cloud storage, compute and access)



3+ years of experience working or exposure to platform engineering with solid product engineering background

3+ years of cloud computing platforms such as azure, aws, big data processing platforms (databricks, snowflake, orchestration tools (airflow, azure data factory) and data streaming platforms (kafka,etc)


preferred qualifications:


prior healthcare experience and prior experience with developing applications/big data platforms (on prem and cloud)



knowledge of professional software engineering practices & best practices for the full software development life cycle, including coding standards, code reviews, source control management, build process, testing and operations

ability to think about larger picture and the whole ecosystem and how our platform product fits in there and how it can enhance the overall experience and adoption."
1047,"experience working with globally distributed team and leading a team of 20+ engineers

experience in handling the financial components of a platform from billing, ioi tracking, hiring, grooming."
1048,"software development experience in building highly scalable applications using agile development practices and on a team with full tech stack (python, iac -> terraform, eac)."
1049,"ability to understand and educate the platform teams on software engineering excellence areas like ci-cd, full automation, version control

full covid-19 vaccination is an essential job function of this role."
1050,candidates located in states that mandate covid-19 booster doses must also comply with those state requirements.
1051,"unitedhealth group will adhere to all federal, state and local regulations as well as all client requirements and will obtain necessary proof of vaccination, and boosters when applicable, prior to employment to ensure compliance."
1052,"candidates must be able to perform all essential job functions with or without reasonable accommodation


to protect the health and safety of our workforce, patients and communities we serve, unitedhealth group and its affiliate companies require all employees to disclose covid-19 vaccination status prior to beginning employment."
1053,"in addition, some roles and locations require full covid-19 vaccination, including boosters, as an essential job function."
1054,"unitedhealth group adheres to all federal, state and local covid-19 vaccination regulations as well as all client covid-19 vaccination requirements and will obtain the necessary information from candidates prior to employment to ensure compliance."
1055,candidates must be able to perform all essential job functions with or without reasonable accommodation.
1056,"failure to meet the vaccination requirement may result in rescission of an employment offer or termination of employment


technology careers with optum."
1057,information and technology have amazing power to transform the health care industry and improve people's lives.
1058,this is where it's happening.
1059,this is where you'll help solve the problems that have never been solved.
1060,we're freeing information so it can be used safely and securely wherever it's needed.
1061,we're creating the very best ideas that can most easily be put into action to help our clients improve the quality of care and lower costs for millions.
1062,this is where the best and the brightest work together to make positive change a reality.
1063,this is the place to do your life's best work.
1064,"(sm)


all employees working remotely will be required to adhere to unitedhealth group’s telecommuter policy."
1065,"colorado, connecticut, nevada, or new york city residents only: the salary range for colorado/connecticut/nevada/new york city residents is $113,500 to $218,100."
1066,"pay is based on several factors including but not limited to education, work experience, certifications, etc."
1067,"in addition to your salary, unitedhealth group offers benefits such as, a comprehensive benefits package, incentive and recognition programs, equity stock purchase and 401k contribution (all benefits are subject to eligibility requirements)."
1068,"no matter where or when you begin a career with unitedhealth group, you’ll find a far-reaching choice of benefits and incentives."
1069,"diversity creates a healthier atmosphere: unitedhealth group is an equal employment opportunity/affirmative action employer and all qualified applicants will receive consideration for employment without regard to race, color, religion, sex, age, national origin, protected veteran status, disability status, sexual orientation, gender identity or expression, marital status, genetic information, or any other characteristic protected by law."
1070,unitedhealth group is a drug - free workplace.
1071,candidates are required to pass a drug test before beginning employment.
1072,"#dice

start your job application: click apply now

show less are you a current us foods employee?"
1073,please apply directly through our internal workday career site.
1074,join our community of food people!
1075,"the iam director is responsible for iam operations, planning, implementation, development, thought leadership, processes, architecture, tools, decision making, and technology following cybersecurity best practices and standards to deliver secure iam solutions."
1076,"the director will maintain, build, lead, execute iam strategies, roadmaps, and initiatives through understanding of us foods security posture, capabilities, risk tolerance, and business drivers."
1077,"in this position, you will work collaboratively with peers and stakeholders to provide guidance and influence technical and business projects to adopt iam strategies to protect enterprise systems balancing business risk and iam security best practices for applications, data, assets, and people of us foods."
1078,new ways of work: the work is completed 100% remote anywhere in the united states except hawaii or united states territories with potential travel of 20% required.
1079,"travel expectations are to be in rosemont, il one (1) week per month (monday morning thru friday afternoon)."
1080,minimal travel to divisions and vendor seminars.
1081,"responsibilities
serve as a leader for iam and ciam areas, identity governance, access management, and privileged access management across internal and external landscapes
develop and define the vision, strategy, framework and roadmaps for enterprise identity and access management including customer iam strategy, zero trust, sso, federation, mfa, privileged access management, provisioning, access certification, identity governance, and role-based access control
lead a team of professionals to architect, implement, and operate the iam strategy, inclusive of staying current on the latest identity management trends, understanding business requirements and opportunities for automation, self-service, and productivity gains, evaluating technologies to meet strategic goals, and instituting a continuous improvement model to mature the iam program
responsible for overall user experience through iam lifecycles, including user on-boarding, birthright access, automated provisioning, and role-based access control for employees, contractors, vendors, and customers
lead the effective delivery of iam services by executing continuous improvements to deliver operational efficiencies such as processing of system access requests, supporting new employee orientation, and iam service evolution and innovation
drive the end-to-end product vision and strategy for your area
serve as a people manager and mentor to iam team members and help further develop us foods iam delivery skills and capabilities
lead technical and business stakeholder conversations
lead large-scale iam transformation programs for us foods from vision and roadmap through to implementation
align iam processes across the organization and develop standards for organizational use
direct employees to implement iam solutions that align with access policies and processes
developing and managing operational run metrics, key performance indicators/outcomes (kpi/kpo) for iam program
manage key vendors to support the overall iam program
create, track, and manage annual operating, capital, and project budgets
record of accomplishment acting with integrity, taking pride in work, seeking to excel, being curious and adaptable, and communicating effectively

supervision: direction and management of 1 architect, 1 developer, 1 sr business security analyst, 1 security analyst

relationships
internal: frontline leaders and managers across it value streams and business organizations."
1082,"key internal functional relationships security engineering, security strategy, security architecture, risk management, threat & vulnerability management, cloud, and compliance, enterprise architecture, product owners, business relationship managers, business architects and analysts, solutions architects, business owners, and technical resources (it infrastructure, network engineers, client engineering, system administrators, developers, etc.)."
1083,"external: manage the relationship with iam mss service provider and product vendors, interacting with account executive, directors of services, and support, and development."
1084,"high interaction with microsoft account executive, director of security for us foods."
1085,"minimum qualifications
must possess a minimum of 15 years of experience with information technology, 8 years of experience with iam or other relevant security areas, and 5+ years personnel management experience
bachelor's degree from an accredited college/university or equivalent professional experience
demonstrated experience with iam relevant technical security products, such as forgerock, microsoft for access management, cyberark for privileged access management, or similar technologies okta, sailpoint, ping, etc."
1086,"strong understanding of the identity and access management concepts including sso, mfa, pam, privileged access, and zero trust networks
strong cybersecurity fundamentals and expertise on identity-driven zero trust architecture
demonstrated experience working with it vendors, suppliers, and managed services providers
required occasional business travel (approximately 5%)

education
bachelor's degree from an accredited college/university or equivalent professional experience
certifications/training: one or more of the following cissp, cams, ciam, cimp, cipa, or cism, giac or other industry certification desired

preferred qualifications
demonstrated experience with iam operations, development, engineering, architecture, auditing, and delivery including operational management methodologies leveraging itsm principles and devops
demonstrated ability to effectively communicate technical and business issues and solutions to multiple organizational levels internally and externally
a proven record of accomplishment of leading the development of product vision and strategy
extensive knowledge of sso, mfa, active directory (ad), public key infrastructure (pki), privileged accounts and integration application program interface (api) capabilities
ability to build and maintain collaborative working relationships with information technology, enterprise security, and business personnel to design and execute appropriate controls
experience in defining, implementing, and executing iam shared services across a global enterprise
demonstrated experience working with it vendors, suppliers, and managed services providers
experience with zero trust access and password less authentication
experience delivering iam solutions using agile methodology
familiarity with customer centric iam solutions, including b2b and b2c scenarios
experience with one or more of the following payment card industry (pci), sarbanes-oxley (sox), health information portability and accountability act (hipaa), general data protection regulation (gdpr), iso 17799, itil or nist
certified information systems security professional

the following information is provided in accordance with the colorado pay equity act."
1087,"compensation depends on experience, geographic locations, and other factors permitted by law."
1088,"in colorado, the expected compensation for this role is between $118,600 and $170,000."
1089,this role is also eligible for annual incentive plan bonus.
1090,"benefits for this role include health insurance, pre-tax spending accounts, retirement benefits, paid time off, short-term and long-term disability, employee stock purchase plan, and life insurance."
1091,"to review available benefits, please click here:
https://www.usfoods.com/careers/benefits.html
."
1092,"#li-cd2
#li-remote

***eoe race/color/religion/sex/sexual orientation/gender identity/national origin/protected veteran/disability status***

apply now: click apply now

show less information security office - security infrastructure, identity & access management
77161br

university job title

manager, it

bargaining unit

none - not included in the union (yale union group)

time type

full time

duration type

regular

compensation grade

administration & operations

compensation grade profile

manager; program leader (m6)

wage ranges

click here to see our wage ranges

work location

central campus

worksite address

150 munson street
new haven, ct 06511

work week

standard (m-f equal number of hours per day)

searchable job family

computing and information systems, technical support

total # of hours to be worked:

37.5

position focus:

the associate director of identity and access management (iam) is a senior leader within the information security office."
1093,"reporting to the director of security infrastructure, this position is responsible for guiding the strategic direction of the all university authentication, authorization, identity correlation and risk based access control activities."
1094,"drives a mature, cross-functional team of developers, analysts, and operational personnel to design, deploy and maintain identity-based solutions/services in accordance with zero trust principles and best practices in quality software development."
1095,"prioritizes roadmap deliverables based on risk, compliance, university initiatives, operational and usability factors."
1096,"liaises with iam steering committee to shape identity and access management policies, processes, and services aligned with university mission priorities."
1097,ensures high availability of iam services through operational rigor.
1098,"oversees ongoing maintenance, monitoring, and level 2-3 support for iam services."
1099,"conducts initiatives to improve systems operation, availability, cost, performance, and manageability across the lifecycle."
1100,works closely with yale’s client technology services to minimize the impact of access control changes on the community.
1101,"work location : can be remote or hybrid

essential duties

1."
1102,"leads, manages, and advises a team of technical experts on all aspects of policies, practices, systems, and procedures within the department."
1103,2.
1104,provides managerial and technical expertise regarding the daily operations in one or more functional areas.
1105,3.
1106,manages and implements guidelines and systems and recommends changes to maintain consistency with the mission of department objectives.
1107,4.
1108,manages and works extensively with staff to develop and administer support plans.
1109,5.
1110,"participates on project teams and act as a liaison with other institutions, campus organizations, vendors, and committees."
1111,6.
1112,"works with all units to identify, analyze, and develop approaches that successfully meets the goals and objectives of its and the university as a whole."
1113,7.
1114,defines and tracks service metrics and work with staff to meet client needs and service standards.
1115,8.
1116,"implements appropriate controls and quality assurance; ensures adherence to the process, consistent and efficient trouble resolution, error reduction, and continuous process improvement."
1117,9.
1118,manages the operating budget for their organizational unit.
1119,10.
1120,recruits and trains technical staff.
1121,11.
1122,ensures compliance and timeliness of all federal and state regulatory requirements.
1123,12.
1124,manages a staff of exempt and non-exempt employees.
1125,13.
1126,may perform other duties as assigned.
1127,"required education and experience

bachelor's degree in a relevant technical field and six years of related technical experience or an equivalent combination of education and experience."
1128,"required skill/ability 1:

ability to lead an identity and access management program in a complex higher education organization, preferably an r1 research institution."
1129,"experience with commercial and open source applications and middleware, including sailpoint identityiq, cas, shibboleth and grouper an asset."
1130,"required skill/ability 2:

demonstrated expertise in cybersecurity frameworks, industry practices, regulatory requirements, standard cybersecurity processes, and the ever-evolving cybersecurity technology landscape."
1131,"required skill/ability 3:

ability to lead and mentor staff."
1132,track record of building and maintaining strong iam teams.
1133,"required skill/ability 4:

excellent oral and written communication, interpersonal, organizational, and planning skills."
1134,weekend hours required?
1135,"occasional

evening hours required?"
1136,"occasional

drug screen

no

health screening

no

background check requirements

all candidates for employment will be subject to pre-employment background screening for this position, which may include motor vehicle, dot certification, drug testing and credit checks based on the position description and job requirements."
1137,all offers are contingent upon the successful completion of the background check.
1138,"for additional information on the background check requirements and process visit ""learn about background checks"" under the applicant support resources section of careers on the it's your yale website."
1139,"covid-19 vaccine requirement

thank you for your interest in employment at yale university."
1140,"please also note that the university has a covid-19 vaccination and booster requirement for all students, staff & faculty which is described in the covid-19 vaccine program."
1141,"as you search our open positions, you will see that all postings list their on-site addresses which gives more detail on the on-campus work location of the role."
1142,"posting disclaimer

the intent of this job description is to provide a representative summary of the essential functions that will be required of the position and should not be construed as a declaration of specific duties and responsibilities of the particular position."
1143,employees will be assigned specific job-related duties through their hiring departments.
1144,"eeo statement:

university policy is committed to affirmative action under law in employment of women, minority group members, individuals with disabilities, and protected veterans."
1145,"additionally, in accordance with yale’s policy against discrimination and harassment, and as delineated by federal and connecticut law, yale does not discriminate in admissions, educational programs, or employment against any individual on account of that individual’s sex, sexual orientation, gender identity or expression, race, color, national or ethnic origin, religion, age, disability, status as a special disabled veteran, veteran of the vietnam era or other covered veteran."
1146,inquiries concerning yale’s policy against discrimination and harassment may be referred to the office of institutional equity and accessibility (oiea).
1147,w.l.
1148,"harkness hall, 3rd floor, room 303
100 wall street, new haven ct 06511
203-432-0849
equity@yale.edu

note

yale university is a tobacco-free campus
show less you lead the way."
1149,we’ve got your back.
1150,"description

at american express, we know that with the right backing, people and businesses have the power to progress in incredible ways."
1151,"whether we’re supporting our customers’ financial confidence to move ahead, taking commerce to new heights, or encouraging people to explore the world, our colleagues are constantly redefining what’s possible — and we’re proud to back each other every step of the way."
1152,"when you join team amex, you become part of a diverse community of over 60,000 colleagues, all with a common goal to deliver an exceptional customer experience every day."
1153,"here, you’ll learn and grow as we champion your meaningful career journey with programs, benefits, and flexibility to back you personally and professionally."
1154,every colleague shares in the company’s success.
1155,"together, we’ll win as a team, striving to uphold our company values and powerful backing promise to our customers, communities, and each other every day."
1156,"and, we’ll do it with integrity and in an environment where everyone is seen, heard and feels like they truly belong."
1157,join #teamamex and let’s lead the way together.
1158,"organizational context

the data center infrastructure (dci) organization provides centralized leadership for core and regional data centers and critical technology environments."
1159,"our data centers are the foundation of american express’ technology platforms, a critical component in providing continual services to our customers while protecting their most confidential and personal information."
1160,dci is a component of the global infrastructure (gi) organization.
1161,"gi is comprised of mainframe and data center infrastructure, cloud engineering & operations, core infrastructure engineering, data services, global technology operations, it service management & risk, and program management."
1162,gi works in partnership with global technology and business unit cio teams to provide american express with premier data center environments.
1163,"range of impact/influence

millions of customers depend on our infrastructure, we depend on you."
1164,"the success of our entire company rests on our systems, networks, and people."
1165,"our program managers know that delivering on that promise takes a resilient, scalable, and efficient infrastructure."
1166,"so if you’re an authority on infrastructure and know the value of supporting technology and the people who depend on it, join our team."
1167,the best infrastructure isn’t built in a day or even a year and it’s certainly not built without a team.
1168,"here’s just some of what you’ll do: contribute to the analysis of business, application, and infrastructure requirements."
1169,"design, build, enhance, and integrate the critical systems infrastructure required to support global technology infrastructure."
1170,"participate in bringing consistent approach to capacity monitoring, availability assessment, maintenance plans, remediation activity, and capital project execution."
1171,"we are looking for an individual to lead our data center raised floor infrastructure technology (rfit) team in the ipc1 data center, joining the dci leadership team focused on service delivery and production support in this core data center."
1172,"the dci rfit team is responsible for providing 7x24 operational support, service delivery and strategic planning for all technology infrastructure across the data center."
1173,"this role is responsible for providing leadership and strategic direction to the rfit team across a wide variety of critical path work streams such as critical infrastructure development, space/power capacity planning, network/power cabling, and technology infrastructure break-fix."
1174,"the dci rfit director leads the governance, operations, resources, infrastructure, and workflow associated with ipc1 data center."
1175,"they will develop interpersonal dedication to ongoing quality and environmental improvement, ensuring that systems performance and service level requirements are met by setting strategies for service delivery, and planning the integration of all vendor and/or supplier services that support the strategic needs of technology in terms of application and infrastructure."
1176,the successful candidate will apply technical knowledge to solve problems possessing an understanding of the interrelationships between various mission critical facility systems and while maintaining a close partnership with building operations teams.
1177,they will also have the opportunity to work in a state-of-the-art facility where they will be included in plan and procedure development.
1178,"the candidate will need to support mission critical facility roles such as mechanical, electrical, and building management systems maintenance."
1179,this position escalates operational availability risks to leadership.
