,0
421,"to initiate a request for an accommodation, contact the hr accommodation team by sending an email to accommodations @fmr.com, or by calling 800-835-5099, prompt 2, option 3."
422,"we welcome those with experience in jobs such as software developer, computer technician, and computer user support specialist and others in the computers and technology to apply."
423,"start your job application: click apply now

show less 
reportdescription

this role creates thought leading identity and access management research for our gartner for technical professionals clients through published research, conversations with client (inquiry), stage presentations, teleconferences, and client meetings."
424,it is important that you have a vision for how identity and access management will evolve worldwide and at a regional level.
425,"what you’ll do:

as a gartner analyst you will meet with clients every day: on the phone, in a video-conference, from the stage at a gartner event or face-to-face during a sales support visit."
426,in every client interaction analysts help clients solve difficult challenges that lead to better performance.
427,"to support these conversations you will research technology, practices and trends and produce written research for gartner clients to download and apply."
428,conduct research and analysis in specific areas of expertise targeting client’s key initiatives.
429,deliver high quality actionable advice through a variety of media.
430,"write high quality, clear, actionable, advisory research documents."
431,remain ahead of the curve on developments and issues within these specified areas as well as applicable adjacent areas.
432,"respond to client questions, create materials for and deliver to clients in person, via teleconference, video conference or webinar and event presentations."
433,maintain the gartner’s industry leadership reputation by responding to press inquiries .
434,proactively work with the wider sales organization and deliver outstanding sales support in order to retain and grow the business.
435,"kindly note this is an individual contributor role, not a management role with direct reports."
436,"what you’ll need:

it helps to be obsessed with your topic!"
437,gartner analysts are correctly viewed as the experts.
438,"this means you need to know your markets, vendors, trends, management practices, etc."
439,and be able to see the forest andthe trees.
440,most gartner analysts have many years of experience and enjoy solving puzzles.
441,"minimum of 12 years of experience in it and/or iam

bachelor's or equivalent experience."
442,"subject matter expertise in identity and access management technologies, with the ability to demonstrate understanding of the business requirements and opportunities in at least one subarea of that market."
443,knowledge of mechanisms for the automation of iam governance and user provisioning tasks.
444,"knowledge of designing, developing, and validating iam interfaces to applications."
445,"knowledge of endpoint, device, application and user identity authentication and access management mechanisms

knowledge of cloud iam architecture and saas-delivered iam services

ability to mentor identity and access management staff at all levels for their role and personal development."
446,broad understanding of identity and access management programs and commercial solutions.
447,demonstrated superior analytical skills.
448,articulate and succinct communication skills.
449,"publishing and speaking engagements an advantage

ability to conduct occasional travel, regionally and globally

#li-remote #li-lt1

who are we?"
450,"gartner delivers actionable, objective insight to executives and their teams."
451,"our expert guidance and tools enable faster, smarter decisions and stronger performance on an organization’s most critical priorities."
452,"we’ve grown exponentially since our founding in 1979 and we're proud to have nearly 16,000 associates globally that support our 14,000+ clients in more than 100 countries."
453,what makes gartner a great place to work?
454,"our teams are composed of individuals from different geographies, cultures, religions, ethnicities, races, genders, sexual orientations, abilities and generations."
455,"we believe that a variety of experiences makes us stronger—as individuals, as communities and as an organization."
456,that’s why we're recognized worldwide as a great place to work year after year.
457,"we've been recognized by fortune as one of the world’s most admired companies, named a best place to work for lgbtq equality by the human rights campaign corporate equality index and a best place to work for disability inclusion by the disability equality index."
458,looking for a place to turn your big ideas into reality?
459,"join #lifeatgartner

what we offer:

our people are our most valuable asset, so we invest in them from day 1."
460,"when you join our team, you’ll have access to a vast array of benefits to help you live your life well."
461,"these resources are designed to support your physical, financial and emotional well-being."
462,we encourage continued personal and professional growth through ongoing learning and development opportunities.
463,"our employee resource groups, charity match and volunteer programs keep you connected to your internal gartner community and causes that matter to you."
464,"the policy of gartner is to provide equal employment opportunities to all applicants and employees without regard to race, color, creed, religion, sex, sexual orientation, gender identity, marital status, citizenship status, age, national origin, ancestry, disability, veteran status, or any other legally protected status and to affirmatively seek to advance the principles of equal employment opportunity."
465,"gartner is committed to being an equal opportunity employer and offers opportunities to all job seekers, including job seekers with disabilities."
466,"if you are a qualified individual with a disability or a disabled veteran, you may request a reasonable accommodation if you are unable or limited in your ability to use or access the company’s career webpage as a result of your disability."
467,you may request reasonable accommodations by calling human resources at +1 (203) 964-0096 or by sending an email to applicantaccommodations@gartner.com .
468,"job requisition id:69805

by submitting your information and application, you confirm that you have read and agree to the country or regional recruitment notice linked below applicable to your place of residence."
469,"gartner applicant privacy link: https://jobs.gartner.com/applicant-privacy-policy

show less chicago/lake forest, il or us virtual


about grainger:


grainger is north america's leading distributor of maintenance, repair, and operating products and services."
470,"our wide assortment, deep expertise, innovative technology solutions and unparalleled customer service keep customers' operations running and their people safe."
471,we're looking for passionate people who can move our company forward.
472,we have a welcoming workplace where you can build a career for yourself while fulfilling our purpose to keep the world working.
473,we embrace new ways of thinking and recognize everyone is an individual.
474,find your way at grainger.
475,"position details:

the director of customer identity and access management (ciam) will lead a growing team in taking our ciam strategy, technology, controls, processes, to the next level."
476,you will report to the ciso and will modernize the grainger ciam program.
477,"you will drive roadmap, strategy, innovation, resourcing, budgeting for all aspects of ciam."
478,you will work with team members to define and build functional and non-functional requirements to facilitate a balance between security and business.
479,you will also be required to assume project/program directorship of large complex engagements.
480,"you will be able to identify high-risk or problem project issues, analyze those project issues, interact with the onsite program/project managers, their direct managers, and executive sponsors to remediate risks or problems and provide visibility of those projects to senior management."
481,"in an operational context, you will offer a depth of knowledge toward the customer identity management space that drives relevant, actionable, and defensible metrics and reporting to varying audiences that aim to deliver transparency in operational efficiency, security, and effectiveness."
482,"you will:


achieve strategic objectives in ciam using creative thinking to create strategic plans and roadmap plans; ensure an overall architecture with consistent uses of data and significant reuse of technology and business services throughout building design; drive integration across all aspects of customer identity architecture
build a collaborative commitment to ciam strategy by considering and evaluating different points of view; create a cohesive argument and improve the portfolio planning model
collaborate with leaders, define architecture by analyzing information requirements; determine systems architecture, components, and technologies; study business capabilities; develop points of views on emerging technologies and evaluate their applicability to business goals and operational requirements."
483,"provide coaching, guidance, and direction on ciam projects, ensuring overall fit with architecture direction
complete unbiased analysis of technology options and develop a practice to determine, approve and manage preferred technologies; maintain a list of approved technologies; create communication strategies that will guide the organization to standard technologies or create new standards as development needs arise
direct strategic programs that may have companywide significance."
484,monitor and report progress/changes against the plan.
485,"develop technical best practices and build technical competencies for the company
ability to adapt quickly to new technologies and changing business requirements
share responsibility with product owners for building reusable and scalable components
firm grasp of security implications to customer identity management designs and solutions; ability to engage information security resources and product owners for optimal configurations and considerations."
486,"drive implementation by motivating and directing the project or program team, a team that may include cross-functional departments, third-party vendors, partners, and employees
must be comfortable in matrix management environments and work effectively with others in managing complex project."
487,"you have:



minimum of 8 years in information security with 5 years focused on identity and access management (ciam or iam)."
488,"bachelor's degree in it / computer science preferred

minimum of 3 years of managing a team."
489,experience with agile frameworks preferred.
490,"strong working knowledge of iam technology and related vendors




demonstrated delivery experience together with competency in creating and managing an overall project plan (including budget, structure, schedule, and staffing) for large-scale engagements."
491,proven experience of the ability to follow solid project management principles.
492,"knowledge of and experience with industry recognized project implementation methodologies and concepts and with a demonstration of depth in software development activities and tasks (planning, design, development, testing, etc.)."
493,customer identity management technical knowledge and experience is preferred.
494,able to interact successfully at the executive management level.
495,excellent communication and organizational skills along with the ability to deliver along with strict (and often time-sensitive) guidelines.
496,"rewards and benefits:


with benefits starting day one, grainger is committed to your safety, health and wellbeing."
497,our programs provide choice and flexibility to meet our team members' individual needs.
498,"check out some of the rewards available to you at grainger
medical, dental, vision, and life insurance plans
generous paid time off (pto) and 6 company holidays per year
automatic 6% 401(k) company contribution each pay period
employee discounts, parental leave, 3:1 match on donations and tuition reimbursement
a comprehensive set of emotional, financial, physical and social wellbeing programs


dei statement


we are committed to equal employment opportunity regardless of race, color, ancestry, religion, sex, national origin, sexual orientation, age, citizenship, marital status, disability, gender, gender identity or expression, or veteran status."
499,we are proud to be an equal opportunity workplace.
500,"start your job application: click apply now

show less site name: stevenage, upper providence, usa - massachusetts - boston
posted date: nov 18 2022


this role can be based in stevenage (uk), upper providence (us) or boston (us)

at gsk, we want to supercharge our data capability to better understand our patients and accelerate our ability to discover vaccines and medicines."
501,"the onyx research data platform organization represents a major investment by gsk r&d and digital & tech, designed to deliver a step-change in our ability to leverage data, knowledge, and prediction to find new medicines."
502,"we are a full-stack shop consisting of product and portfolio leadership, data engineering, infrastructure and devops, data / metadata / knowledge platforms, and ai/ml and analysis platforms, all geared toward:

building a next-generation, metadata- and automation-driven data experience for gsk’s scientists, engineers, and decision-makers, increasing productivity and reducing time spent on “data mechanics”

providing best-in-class ai/ml and data analysis environments to accelerate our predictive capabilities and attract top-tier talent

aggressively engineering our data at scale, as one unified asset, to unlock the value of our unique collection of data and predictions in real-time

onyx product management is at the heart of our mission, ensuring that everything from our infrastructure, to platforms, to end-user facing data assets and environments is designed to maximize our impact on r&d."
503,"this role is a leadership team member accountable for building and leading a high-functioning team that:

partners with r&d stakeholders and onyx leadership to develop a strategic roadmap for all customer-facing aspects of onyx, including data assets, ontology, knowledge graph / semantic search, data / computing / analysis platforms, and data-powered applications

partner with the head of onyx portfolio management, and the heads of the onyx engineering functions, to facilitate joint planning, execute on that roadmap, help balance strategic development vs customer-facing deliverables, etc."
504,"devise, track, and publicize metrics for the onyx organization’s impact and performance

hire, develop, and retain a talented team of product managers and bioinformaticians that understand the business areas, the onyx capabilities available, how to translate needs into requirements aligned to standard frameworks (e.g."
505,"ontologies, engineering pipelines etc) to ensure the customers get what they need

the head of product for the onyx organization is an internally credible deep technical leader and the voice of r&d across all of our products and services."
506,"this senior leader (and their team of accomplished product managers) is accountable for building a strategy and roadmap that maximize our impact on the productivity of r&d scientists, analysts, engineers, and decision-makers and ultimately on the r&d pipeline, and for partnering with the heads of program management and the engineering functions in executing on that strategy."
507,"the roadmap will also need to accurately represent the needs and delivery plans of decision makers, scientists, and engineers at gsk r&d; partnering with programme teams to ensure we are executing effectively and transparently."
508,"key responsibilities

overall responsibility for product strategy across onyx with a proven track record of building and executing on data strategy and a portfolio of data products in the pharmaceuticals industry or related life sciences industry with accountable for delivering value to the customer and ensuring the right solutions are built."
509,"be consistently on top of the latest scientific advancements in the life sciences, particularly genetics / molecular biology

be able to speak with life sciences researchers in their own language, understand their ways of working, and help them understand the value that proper data, metadata, and platforms can bring to their daily lives

have a demonstrated history of building and managing high-performing, agile teams in engineering, product management, and/or life sciences research with a bias toward defining success metrics at the start of any endeavour

have a deep understanding of the value of ontology and computable metadata and its applications in the life sciences and / or clinical data

partner with the programme management team to ensure realistic and appropriate plans are created."
510,"also responsible for the management of the solutions, including monitoring progress, testing the solutions with customers, and ensuring completed products are delivered to the customers across onyx."
511,"minimum level of education required

masters or phd in bioinformatics, biomedical science, biomedical engineering, molecular biology, or computer science (with a life sciences application focus)

minimum level of job-related experience required

10+ years of experience leading projects defining, building, and delivering data products in biotech, pharmaceuticals, healthcare, diagnostics, or other life sciences industry."
512,be familiar with modern devops-first software development and release practices.
513,"#li-gsk #gskonyx

gsk is a global biopharma company with a special purpose – to unite science, technology and talent to get ahead of disease together – so we can positively impact the health of billions of people and deliver stronger, more sustainable shareholder returns – as an organisation where people can thrive."
514,"getting ahead means preventing disease as well as treating it, and we aim to impact the health of 2.5 billion people around the world in the next 10 years."
515,our success absolutely depends on our people.
516,"while getting ahead of disease together is about our ambition for patients and shareholders, it’s also about making gsk a place where people can thrive."
517,we want gsk to be a workplace where everyone can feel a sense of belonging and thrive as set out in our equal and inclusive treatment of employees policy.
518,"we’re committed to being more proactive at all levels so that our workforce reflects the communities we work and hire in, and our gsk leadership reflects our gsk workforce."
519,"as an equal opportunity employer, we are open to all talent."
520,"in the us, we also adhere to affirmative action principles."
521,"this ensures that all qualified applicants will receive equal consideration for employment without regard to neurodiversity, race/ethnicity, colour, national origin, religion, gender, pregnancy, marital status, sexual orientation, gender identity/expression, age, disability, genetic information, military service, covered/protected veteran status or any other federal, state or local protected class*(*us only)."
522,we believe in an agile working culture for all our roles.
523,"if flexibility is important to you, we encourage you to explore with our hiring team what the opportunities are."
524,please don’t hesitate to contact us if you’d like to discuss any adjustments to our process which might help you demonstrate your strengths and capabilities.
525,"you can either call us on 0808 234 4391, or send an email ukdiversity.recruitment@gsk.com

as you apply, we will ask you to share some personal information which is entirely voluntary."
526,we want to have an opportunity to consider a diverse pool of qualified candidates and this information will assist us in meeting that objective and in understanding how well we are doing against our inclusion and diversity ambitions.
527,we would really appreciate it if you could take a few moments to complete it.
528,"rest assured, hiring managers do not have access to this information and we will treat your information confidentially."
529,"important notice to employment businesses/ agencies

gsk does not accept referrals from employment businesses and/or employment agencies in respect of the vacancies posted on this site."
530,all employment businesses/agencies are required to contact gsk's commercial and general procurement/human resources department to obtain prior written authorization before referring any candidates to gsk.
531,the obtaining of prior written authorization is a condition precedent to any agreement (verbal or written) between the employment business/ agency and gsk.
532,in the absence of such written authorization being obtained any actions undertaken by the employment business/agency shall be deemed to have been performed without the consent or contractual agreement of gsk.
533,gsk shall therefore not be liable for any fees arising from such actions or any fees arising from any referrals by employment businesses/agencies in respect of the vacancies posted on this site.
534,"please note that if you are a us licensed healthcare professional or healthcare professional as defined by the laws of the state issuing your license, gsk may be required to capture and report expenses gsk incurs, on your behalf, in the event you are afforded an interview for employment."
535,this capture of applicable transfers of value is necessary to ensure gsk’s compliance to all federal and state us transparency requirements.
536,"for more information, please visit gsk’s transparency reporting for the record site."
537,"apply now: click apply now

show less 
reportdescription: we are halo!"
538,"we build brand engagement for our over 60,000 clients globally and lead our $25b industry through the dedication of over 2,000 team members across the united states."
539,halo seeks a senior director of change and transformation enablement to join the newly formed business transformation office.
540,"in this critical and highly visible role, you will lead, develop, and execute strategies to accelerate adoption of new technology, processes, and solutions."
541,"you will harness and enable an extended network of change agents across the organization to effect company-wide culture and behavior change in support of halo’s strategic priorities, transformation objectives and portfolio."
542,you will deliver change management strategies and tactics while also driving team effectiveness to accelerate cross-functional and vendor team performance.
543,"as the leader of change and transformation enablement, you will be the link to and key driver to establish and mature the function and own its success to enable change and transformation at halo."
544,"the successful candidate will bring a combination of experience in organizational change management and project management and will have worked in both consulting and industry roles supporting organizational change and transformation initiatives (structure, people, process, technology)."
545,"this position can be based anywhere within the us, although ideally located in the chicagoland area."
