,0
765,"experience:
global scope: proven ability to launch services globally - including united states, latin america, europe, and asia."
766,"partnerships: cable & carrier product launches in partnership with u.s., emea, latam, and other regions."
767,"platforms: products with device & operating system partners on a global scale, across mobile, tablet, and set top boxes."
768,identity: working knowledge of authentication & access for subscription services.
769,"entitlements: demonstrated experience with various levels of subscription services, including free trial conversion, up/downgrades, and global customer access."
770,"payments: applied experience in payments, taxation & monetization on a global scale."
771,"legal & compliance: working with legal, privacy, security, and compliance teams at a global scale."
772,"technical: you understand systems, client & server architecture - you understand how products are built."
773,demonstrated working knowledge of payment & taxation providers & systems.
774,"demonstrated working knowledge of authentication & entitlement services - how customers gain access to a service, up/downgrade, etc."
775,"working on multi-platform applications - web, mobile app, smart tv & game console."
776,"understanding of complex direct-to-consumer (dtc) subscription flows via web & app stores - eg: apple itunes / google play / amazon / roku, partner oauth & federation."
777,"team building: you have identified exceptional team members, you have hired the best - you build careers, inspire others, and lead by example."
778,"education:
degree in a technical engineering, technical business, or similar field

bonus:technical aptitude:
fluency in one or more coding and/or database languages,i.e."
779,"javascript, react, json sql/mysql, swift, etc."
780,working knowledge of service oriented architecture.
781,"working knowledge of recurly, oauth, tv everywhere, intro offers, promotional codes, etc."
782,"user experience:
deep understanding of core user experience, visual design, and user research principles."
783,"ability to wireframe, whiteboard, build user flows - figma, sketch, or similar."
784,"ability to articulate complex user needs to various stakeholder teams - including executives, partners, and working teams."
785,"data:
fluency in data architecture, data constructs, sql, etc."
786,familiarity with monitoring and diagnostic tool sets - i.e.
787,"jsonlint, charles proxy, new relic, conviva, etc."
788,"additional information

hiring salary range: $175,000.00 - 200,000.00."
789,"the hiring salary range for this position applies to new york city, california, colorado, washington state, and most other geographies."
790,"starting pay for the successful applicant depends on a variety of job-related factors, including but not limited to geographic location, market demands, experience, training, and education."
791,"the benefits available for this position include medical, dental, vision, 401(k) plan, life insurance coverage, disability benefits, tuition assistance program and pto or, if applicable, as otherwise dictated by the appropriate collective bargaining agreement."
792,this position is bonus eligible.
793,"https://www.paramount.com/careers/benefits

paramount is an equal opportunity employer (eoe) including disability/vet."
794,"at paramount, the spirit of inclusion feeds into everything that we do, on-screen and off."
795,"from the programming and movies we create to employee benefits/programs and social impact outreach initiatives, we believe that opportunity, access, resources and rewards should be available to and for the benefit of all."
796,paramount is proud to be an equal opportunity workplace and is an affirmative action employer.
797,"we are committed to equal employment opportunity regardless of race, color, ethnicity, ancestry, religion, creed, sex, national origin, sexual orientation, age, citizenship status, marital status, disability, gender identity, gender expression, and veteran status."
798,"if you are a qualified individual with a disability or a disabled veteran, you may request a reasonable accommodation if you are unable or limited in your ability to use or access."
799,https://www.paramount.com/careers as a result of your disability.
800,you can request reasonable accommodations by calling 212.846.5500 or by sending an email to viacomaccommodations@viacom.com.
801,only messages left for this purpose will be returned.
802,"to apply to this job, click apply now

show less 
reportinterested in a career with both meaning and growth?"
803,"whether your abilities are in direct patient care or one of the many other areas of healthcare administration and support, everyone at parkland works together to fulfill our mission: the health and well-being of individuals and communities entrusted to our care."
804,"by joining parkland, you become part of a diverse healthcare legacy that‚äôs served our community for more than 125 years."
805,"put your skills to work with us, seek opportunities to learn and join a talented team where patient care is more than a job."
806,it‚äôs our passion.
807,"primary purpose



responsible for parkland‚äôs enterprise information systems operations, including service desk, desktop support, and it asset management of end-user devices."
808,"also responsible for oversight of outsourced functions such as managed print services, contact center as a service (ccaas), and other vendors."
809,"supports development and enforcement of core itil operational processes such as change management, incident management, problem management, major incident management, and request fulfillment."
810,"minimum specifications

education
bachelor's degree in computer science, telecommunications, information systems, business administration, or a related field."
811,prefer a master‚äôs degree.
812,"experience
must have ten years of management experience in a large information technology environment."
813,must have experience managing a service-level agreement (sla) driven outsourcing contract.
814,"must have experience with oversight of directly employed staff, as well as third party staff."
815,prefer operational experience in a hospital setting.
816,prefer experience with emr system implementation and/or emr lifecycle management.
817,"equivalent education and/or experience
may have an equivalent combination of education and/or experience in lieu of specific education and/or experience as stated above."
818,"certification/registration/licensure
prefer an information technology infrastructure library (itil) foundation or practitioner certification."
819,prefer a project management professional (pmp) certification.
820,"skills or special abilities
must demonstrate excellent verbal and written communication skills, and the ability to relate effectively with diverse groups of parkland employees."
821,"must have strong leadership, planning, and organizational skills."
822,must have a significant understanding of multi-platform it environments.
823,must be able to demonstrate both analytical and statistical skills.
824,"must have excellent presentation skills, and personal computer skills in powerpoint, access, microsoft word, and excel software."
825,must be able to demonstrate effective management skills and techniques.
826,must be customer service oriented.
827,"responsibilities
identifies and analyzes the design of jobs, work processes, work flows, etc."
828,"for the it service operations department and implements appropriate changes to improve effectiveness, productivity, and efficiency that support the overall goals of the department and parkland."
829,"selects, trains, schedules, motivates, supervises, and evaluates employees, making recommendations for disciplinary actions up to and including termination, to ensure maximum utilization of individual and group capabilities."
830,ensures that assigned employees receive opportunities to further their knowledge.
831,"provides daily operational oversight and acts as an escalation point for the service desk, end user computing, and correctional health teams in it, along with outsourced services, ensuring customer service issues are addressed."
832,assists in the prioritization of daily activities for each team as needed.
833,"conducts regularly scheduled meetings, including the daily operational meeting and the weekly change meeting."
834,also responsible for ad-hoc meetings such as the root cause analysis meetings and process improvement meetings designed to improve specific team activities and inter-team communications.
835,develops and monitors annual budgets that ensure the it service operations department has the necessary funds to carry out the goals and objectives that have been established for the department.
836,"develops, implements, monitors, and revises annual goals and objectives for the it service operations department that support the missions and objectives of parkland."
837,"maintains knowledge of applicable rules, regulations, policies, laws and guidelines that impact the it service operations department."
838,"develops effective internal controls that promote adherence to applicable state/federal laws, and the program requirements of accreditation agencies and federal, state and private health plans."
839,seeks advice and guidance as necessary to ensure proper understanding.
840,"stays abreast of the latest developments, advancements, and trends in the field of information systems by attending seminars/workshops, reading professional journals, and actively participating in professional organizations."
841,integrates knowledge gained into current work practices.
842,monitors performance of outsourced vendors through regularly scheduled meetings and through reporting mechanisms such as monthly sla reports.
843,interacts with vendors for issues resolution as needed.
844,"working with it management, responsible for organizing and leading special projects to demonstrate and develop innovative solutions for information issues of concern for parkland."
845,"ensures that assigned employees understand how they can individually provide customer service to patients, employees, and vendors by monitoring employee progress to ensure expectations are being met."
846,"maintains a cooperative working relationship with client departments, senior management, vendors, and other hospitals to ensure that information needs can be identified and met."
847,interfaces with parkland departments and users at meetings as required.
848,follows up with end user departments regarding reports of poor service.
849,"job accountabilities
identifies and analyzes the design of jobs, work processes, work flows, etc."
850,"for the area and implements appropriate changes to improve effectiveness, productivity, and efficiency that support the overall goals of the department and parkland."
851,"stays abreast of the latest developments, advancements, and trends in the field by attending seminars/workshops, reading professional journals, actively participating in professional organizations, and/or maintaining certification or licensure."
852,integrates knowledge gained into current work practices.
853,"maintains knowledge of applicable rules, regulations, policies, laws and guidelines that impact the area."
854,"develops effective internal controls designed to promote adherence with applicable laws, accreditation agency requirements, and federal, state, and private health plans."
855,seeks advice and guidance as needed to ensure proper understanding.
856,develops and monitors annual budgets that ensure the department has the necessary funds to carry out the goals and objectives that have been established for the department.
857,"develops, implements, monitors, and revises annual goals and objectives for the department that support the missions and objectives of parkland."
858,"selects, trains, schedules, motivates, supervises, and evaluates employees making recommendations for disciplinary actions up to and including termination, to ensure maximum utilization of individual and group capabilities."
859,ensures that assigned employees receive opportunities to further their knowledge.
860,"#li-rb1
parkland health and hospital system prohibits discrimination based on age (40 or over), race, color, religion, sex (including pregnancy), sexual orientation, gender identity, gender expression, genetic information, disability, national origin, marital status, political belief, or veteran status."
861,"show less overview

the identity and access management (iam) director will be responsible for end to end architecture, design, engineering, delivery, and support of enterprise ldap, active directory, azure active directory, and privileged access management products and services."
862,"the director will lead global teams, driving discussions across various pepsico project teams and other staff developers and operations team to ensure that pepsico information security guidelines and standards are adhered to while meeting the requirements for the business."
863,"the iam director must possess experience with delivering solutions across directory services, privileged account management, as well as foundational security infrastructure concepts across operating systems, networking, and n-tiered architectures with good troubleshooting skills."
864,"the iam director will be expected to continuously improve the time, cost and risk associated with privileged access management, directory platforms while driving future direction and evolution of iam technologies and processes."
865,"responsibilities

this role has end to end accountability for enterprise directory services, active directory services, azure active directory services and privileged account management services and platforms/products driving programs, engineering activities, ongoing support
manage global pepsico ldaps (ad, azure ad, enterprise ldap and other instances) products, environments and solutions supporting 700k+ accounts and 380k+ identities
support the multi-year cloud transformation journey that includes operationalizing the required technology foundations in a hybrid multi-cloud environment
lead multi-year program building new ldap platform, migrating applications from legacy to new oracle ldap platform to provide a more secure and supportable enterprise ldap solution to pepsico
drive the transformation of pepsico pam solution and the increased onboarding of privileged accounts including it and ot."
866,the service supports 400k+ current accounts with a growth rate of approximately 3k accounts annually.
867,"stay current on technologies and industry trends in the areas of responsibility and manage vendor relationships
manage baseline and investment budgets for areas of responsibility
manage contractors with vendors for services and licenses partnering with appropriate teams
drive strategy and roadmap for iam
technical leader for iam solutions
manage engineering and operations teams globally
manage pam tools for account/password management, privileged access request provisioning / de-provisioning of access including recertification end to end
manage authentication and authorization utilizing directory solutions
manage operational teams across directories and pam driving incident resolution, troubleshooting and issue resolution across areas
gather requirements and guide / recommend the right integration pattern for applications needing services, taking into consideration the impact to the environment and standards set in pepsico
drive technical integrations across areas of responsibility and ensure the right architecture/design is implemented in enabling the business partnering across appropriate architects and leads
specifying guidelines and supporting processes for integration, administration and maintenance
developing general purpose services, usable by a variety of authorized systems and applications
interaction with application teams to gather requirements, design and deliver solution to integrate with pepsico iam products
recommend improvements, corrections, remediation or requirements for associated projects
create and maintain documentation for appropriate iam related activities and metric reporting
advocate secure computing practices, procedures, and communicate information security best practices throughout the company."
868,"ability to troubleshoot and resolve issues quickly identifying the best option in an emergency
ability to work with different teams and interact with technical and business folks across the enterprise
drive communications and present across different levels of organization
covid-19 vaccination is a condition of employment for this role."
869,"please note that all such company vaccine requirements provide the opportunity to request an approved accommodation or exemption under applicable law

qualifications

12+ years overall it experience
10+ years of experience with directories such as odsee, oud, ad, aads
7+ years of experience with privileged access management solutions such as tpam, cyberark
6+ years of information security experience with a focus in iam
8+ years of experience with troubleshooting issues with directory solutions, and applications
5+ years of experience with developing tools with ldap via jndi preferred
5+ years of experience with web application management
5+ years of working experience with building and using shell and pearl scripts
advanced understanding of user life cycle management, authentication/authorizations and controls around privileged access
functional:
ability to guide teams through complex issues and drive resolution for issues that arise within complex and high risk applications
ability to effectively translate technical information between vendors, it management and other internal and external it teams
ability to work with all levels of management to define requirements associated with iam services, incorporating security best practices
ability to build project plans, translate directives, and present project deliverables to upper management
advanced understanding of the broader impact of information security from a business perspective
understanding of business processes associated with identity and access management lifecycle and ability to design and implement solutions that meet complex business requirements preferred
experience managing global teams that include employees and vendors
experience managing vendors driving slas
soft skills
collaborate across global teams and partner across different levels
drive global programs across sectors partnering with global teams
mentor team members
ability to clearly communicate thoughts and ideas in both oral and written formats."
870,"self-motivated and ability to prioritize and handle tasks in a fast-paced environment
proven track record of achieving results through collaboration and teamwork
foster company success through a professional appearance, being courteous to customers and all pepsico associates and by having a positive attitude

eeo statement

all qualified applicants will receive consideration for employment without regard to race, color, religion, sex, sexual orientation, gender identity, national origin, protected veteran status, or disability status."
871,"pepsico is an equal opportunity employer: female / minority / disability / protected veteran / sexual orientation / gender identity

if you'd like more information about your eeo rights as an applicant under the law, please download the available eeo is the law & eeo is the law supplement documents."
872,view pepsico eeo policy.
873,"please view our pay transparency statement

apply now: click apply now

show less about the role

second front systems (2f) is seeking a motivated director of it to support our team."
874,we are a fast-growing entrepreneurial team working at the convergence of technology and national security.
875,the work will be dynamic and wide-ranging with operations supporting the deployment and scale of our game warden platform.
876,"as the director of it at second front systems, your responsibilities are to integrate and manage business and security tools that support the entire second front team, including responding to outages and providing technical assistance to other team members when required."
877,"you will be responsible for helping to select the right tools that enable second front’s business, and ensure that those tools can be integrated with existing it systems, and can be implemented with advanced security features to limit the risk of data loss."
878,"you’ll champion automation to reduce cost, both in manual engineering effort and dollars."
879,you’ll prioritize documentation that allows both internal and external end-users to clearly understand our systems and processes.
880,"you will be leading a small team of it specialists, which will include employees, contractors, and interns."
881,"finally, you are responsible for learning new things, solving big problems, speaking your mind, and contributing to a culture of diversity, innovation, and excellence.‍

note: this position requires u.s. citizenship due to government contract requirements."
882,"what you’ll do

our it team is responsible for building and delivering cloud-native tools and services for second front business and product teams, with an emphasis on automation and security."
883,"specific tasks include:

perform it support duties as directed
provide remote management and security of end user devices
coordinate with infrastructure team for security and monitoring of cloud services
build and maintain an identity access and a management system that syncs across multiple business systems, creating a seamless user experience
track physical equipment and software licenses for company purchased products
operate and maintain a trouble ticket system, integrated with company messaging systems
implement automation to create efficiencies in it process for both hardware and software
ensure documentation of our systems and processes
coordinate activities with cto and coo

skills you’ll bring to our team

able to be a positive influence on the company
comfortable working on complex it problems, striving to find unique solutions to problems."
884,"always try to get to yes, rather than telling users no."
885,"ability to research and analyze product offerings for business systems and security tools for implementation by the company
experience solving complex and sometimes ill-defined problems
extensive knowledge of gsuite, ldap, and okta integration and administration
extensive knowledge of api integrations and automation scripting
knowledge of aws cloud administration and security configurations
excellent communication skills to create and implement it policies and procedures
7-10 years of relevant experience

preferred qualifications

able to obtain a secret-level security clearance
certification in cloud administration, network administration, it operations, or cybersecurity
have a strong interest in matters of national security

success at 2f looks like:

viewing obstacles as opportunities for growth
having a bias toward action and tangible, measurable results
striving to be both compassionate and direct with your feedback
being team-oriented and inclusive with your actions

perks & benefits

this role is a full-time role."
886,"as a public benefit corporation, we’re a team of purpose-driven trailblazers transforming the future of u.s. national security."
887,"we hire the best to do their best and, as such, we are committed to providing the perks and benefits you need to be successful—both in- and outside the workplace."
888,"we offer you:

competitive salary
healthcare, vision and dental coverage
401(k) + 3% company contribution
wellness perks (fitness classes, mental health resources)
equity incentive plan
tech + office supplies stipend
annual professional development stipend
flexible paid time off + federal holidays off
parental leave
work from anywhere
referral bonus

visit our careers page to learn more."
889,"who we are
at second front systems (2f), we equip defense and national security professionals for long-term, continuous competition for access to emerging technologies."
890,"founded by two former u.s. marines with firsthand experience of the dangers outdated technology poses in combat, our team is dedicated to fast-tracking government access to disruptive, commercially-proven technology for u.s. national security missions."
891,"our game warden product, a fully managed and compliant devsecops platform, accelerates the process for accrediting software as a service (saas) applications for government use."
892,"learn how 2f can help you make an impact on national security missions at www.secondfront.com

one last thing…
research shows that candidates from underrepresented backgrounds often don't apply for roles if they don't meet all the criteria

we strongly encourage you to apply if you’re interested—we'd love to know how you can amplify our team with your unique experience."
893,show less this role can be located anywhere globally.
894,"at the coca-cola company (tccc), our environmental, social and governance (esg) goals and commitments are anchored by our purpose ‘to refresh the world and make a difference’ and are core to our growth strategy."
895,"to create a more sustainable business and better shared future, the cola-cola system (tccs) has the following strategic initiatives on water stewardship:

reduce shared water challenges where we operate, through advanced efficiency and regenerative water use."
896,"enhance community resilience through water and sanitation access, and climate adaptation."
897,"improve watershed health where we operate and source ingredients, while continuing to achieve 100% replenishment."
